Date,Headline
2022-12-29,"FII : Expect market to remain volatile in 2023 , FII flows to slowly come in : Aveek Mitra"
2022-12-29,"Recession , interest rate : Indian Equities Could Face Rough Weather in 2023 As Global Uncertainties Persist"
2022-12-29,Indian equities may sail into choppy waters on global headwinds in 2023
2022-12-29,Why 2023 Promises to Be a Rough Year For India External Sector
2022-12-29,KFin Technologies makes listless debut ; slips over 2 % from issue price
2022-12-29,"Stock Market India : Sensex Falls Over 300 Points , Extending Losses For Second Straight Session"
2022-12-29,Indian Rupee Trades Flat Against UAE Dirham
2022-12-29,USD / INR forecast 2023 : Rupee forms a double - top pattern
2022-12-30,"Stock Market India : Sensex Falls On Friday , But Closes 2022 With 4 . 4 % Gain At 60 , 840 . 74"
2022-12-30,India - based Online Trading Platform Upstox Reports Steady Business Growth
2022-12-30,Rupee gains 16 paise to 82 . 71 against US dollar in early trade
2022-12-30,nifty | sensex : 2022 in numbers : New records and heartbreaks for stock investors
2022-12-30,નિફ્ટી ફયુચર ૧૮૧૮૮ પોઈન્ટ મહત્વની સપાટી ...!!!
2022-12-30,Stocks end 2022 on a high as DII buying offsets FPI exit - The Hindu BusinessLine
2022-12-30,Outlook 2023 : Equity investors need to take calibrated calls as headwinds persist
2022-12-30,"Sensex closes 2022 with annual gain of 4 . 44 pc , Nifty ends up 4 . 32 pc"
2022-12-30,साल के आखिरी दिन गिरावट पर रहा शेयर बाजार
2022-12-30,"Sensex , Nifty end 2022 with over 4 % gains : How markets outperformed global peers"
2022-12-30,Passive funds scores over actively managed equity funds - The Hindu BusinessLine
2022-12-30,Barometers turn red ; oil & gas stocks rise for 4th day | Business Standard News
2022-12-30,Business Tips of The Day : साल के आखिरी कारोबारी दिन Reliance और Eicher Motors भर सकते हैं निवेशकों की झोली
2022-12-30,Benchmarks end with minor cuts ; FMCG stocks decline
2022-12-30,stocks to buy : Stocks to buy or sell today : 4 short - term trading ideas by experts for 30 December 2022
2022-12-30,"Sensex and Nifty open with gains , tracking strong global cues"
2022-12-30,Stocks Outlook 2023 : Investors Need To Take Calibrated Approach As Headwinds Persist
2022-12-30,"Sensex adds 70 pts ; Nifty above 18 , 200 ; VIX down 1 . 75 %"
2022-12-30,Indices trade with decent gains ; metal stocks in demand
2022-12-30,earnings growth : 2023 likely to be a challenging year for equity returns : Rohit Agarwal
2022-12-30,India current account deficit surges to record $36 . 4 billion in September quarter
2022-12-30,stock market expected to bounce on the last trading day of the year which is 30th dec 2022 - साल के आखिरी कारोबारी दिन को शेयर बाजार के उछलने के आसार
2022-12-30,CAD Surges to Record $36 . 4 b in Sept Quarter
2022-12-30,"Asset class scorecard : While gold sparkles , cryptos bleed - The Hindu BusinessLine"
2022-12-30,"3 - 2 - 1 ... 2023 , How the world shaping up to a new order"
2022-12-30,"Sensex drops 293 pts on fag - end selling ; Nifty holds 18 , 100 mark"
2022-12-30,Stock market holidays in 2023 : Trading to be shut for 15 days next year
2022-12-30,"Sensex , Nifty50 to open in the green amid positive global cues – RIL , Eicher Motors , Elin Electronics among stocks to watch today"
2022-12-30,"Stock Market India : Sensex Rises 122 Points , Extending Gains For Second Straight Day"
2022-12-30,Last Trading Day Of 2022 RIL HG Infra Welspun India To Make Investors Smile
2022-12-30,Benchmarks trade with decent gains ; PSU bank stocks edge higher
2022-12-31,"Skipper Ltd wins New order of Rs 2 , 570 crores for BSNL 4G Telecom Projects"
2022-12-31,"After a turbulent year for cryptocurrency , 2023 may see movement towards regulatory norms"
2022-12-31,"Indices Tumble on Last Day , But D St Stands Tall in 2022"
2022-12-31,Nanayam Vikatan - 08 January 2023 - இன்வெஸ்ட்மென்ட் பிளான் - 2023 லாபத்துக்குக் கைகொடுக்கும்  அஸெட் அலொகேஷன்  டெக்னிக் ! | new year 2023 asset allocation plan in investment
2022-12-31,Nanayam Vikatan - 08 January 2023 - ஷேர்லக் : 2023 - ம் ஆண்டில் சென்செக்ஸ் 71600 ... புத்தாண்டில் கவனிக்க வேண்டிய பங்குகள் ..! | share market news based analysis
2022-12-31,"Nifty : Indices tumble on last day , but Dalal Street stands tall in 2022"
2022-12-31,"Sensex , Nifty May Try to Rally - Weekly Closing Report"
2022-12-31,"Year End 2022 : उतार - चढ़ाव के बाद भी इस साल इतिहास रचने सफल रहे Nifty - Sensex , निवेशकों के खिल उठे चेहरे"
2022-12-31,"central banks : Outlook 2023 : Financials , cement , infra , renewable energy stocks to hog limelight next year"
2022-12-31,शेयर बाजार ने इस वर्ष निवेशकों को दिया चार फिसद से अधिक रिटर्न
2022-12-31,"Outlook 2023 : Financials , cement , infra , renewable energy stocks to hog limelight next year"
2022-12-31,Indian indices continued to gain for the seventh year in a row
2022-12-31,"Stock to Watch 2023 : Infosys , SBI , ITC , Titan among top picks by Motilal Oswal"
2022-12-31,Rupee outlook depends largely on global monetary policy moves
2022-12-31,War in Ukraine to tech layoffs : A look at 10 events that defined 2022
2022-12-31,Raghuram Rajan : Promote significant reforms going forward in order to elevate growth : Raghuram Rajan
2022-12-31,Stock Market Today : Sensex Nifty Snap Three - Week Losing Streak ; Broader Markets Outperform
2022-12-31,Indian economy performs well in 2022 | The Navhind Times
2022-12-31,HPL Electric and Power Ltd wins Rs . 161 crore Smart Meter Order
2022-12-31,Birlasoft Enables Best Value Chem Pvt . Ltd . to Drive Scalability through Successful Implementation of RISE with SAP
2022-12-31,"Outlook 2023 : Financials , cement , infra , renewable energy stocks to hog limelight next year - Jammu Kashmir Latest News | Tourism"
2023-01-01,"Yearender : Markets saw new heights , volatility from multiple headwinds in 2022"
2023-01-01,नए साल में 10 बातों से जानिए व्यवसाय जगत के लिए कैसा रहा 2022 ?
2023-01-01,dalal street : Green light on Dalal Street on 1st trading day of 2023 ? Here what history suggests
2023-01-01,ಏರಿಕೆ ಹಾದಿಗೆ ಮರಳಿದ ಸೂಚ್ಯಂಕಗಳು
2023-01-01,View : Grow a budget in this climate
2023-01-01,Shape of things to come
2023-01-01,"Cushioning CAD , some hard facts"
2023-01-01,"Rupee falls over 11 % in 2022 , worst among Asian currencies"
2023-01-01,"Currency - Rupee falls over 11 per cent in 2022 , worst since 2013"
2023-01-01,Rupee falls over 11 % in 2022 -- worst since 2013
2023-01-01,Crystal gazing into 2023 : 4 top factors that will set the tone for investors
2023-01-01,Equity investors need to assess and calculate their moves as headwinds persist
2023-01-02,Indian economy poised for further growth in 2023 despite global headwinds - Jammu Kashmir Latest News | Tourism
2023-01-02,Indian economy poised for further growth in 2023 despite global headwinds
2023-01-02,Welcome To IANS Live - BUSINESS - Indian banking will maintain its growth momentum : South Indian Bank MD & CEO
2023-01-02,Welcome To IANS Live - LatestNews - Indian banking will maintain its growth momentum : South Indian Bank MD & CEO
2023-01-02,Indian banking will maintain its growth momentum : South Indian Bank MD & CEO
2023-01-02,India economy news : Indian economy poised for further growth in 2023 despite global headwinds
2023-01-02,Indian economy poised for further growth despite global headwinds : Analysts
2023-01-03,2022 Data Point recap - The Hindu
2023-01-03,Rupee Today : Rupee threat to slip below 83 / USD likely nipped by RBI
2023-01-03,Rupee threat to slip below 83 per US dollar likely nipped by RBI
2023-01-03,Why the retail investor is going to drive India growth story in 2023
2023-01-03,"ETMarkets Smart Talk : Expensive valuations , CAD , currency among top headwinds for Indian markets in 2023"
2023-01-03,india budget : Budget 2023 : The dramatic changes in the world since India last Budget
2023-01-04,View : High taxes for Crypto helped India dodge the bullet
2023-01-05,How crypto taxes helped India
2023-01-05,RBI Likely Sold Dollars to Nip the Threat of Rupee Slipping Below 83 Mark on Tuesday
2023-01-05,Key Long - term Economic Metrics Show No Sign of Improvement
2023-01-05,Which is more cost - effective for Indian expats - taking a loan back home or the UAE ?
2023-01-06,"Indian Economy : An Oasis in the Gloomy Global Desert - Nilesh Shah , Group President , and MD , Kotak Mahindra Asset Management"
2023-01-06,"rupee : Rupee , worst emerging Asia currency of 2022 , may fall further"
2023-01-06,"Govt , RBI in discussion with South Asian countries for cross - border rupee trade : Das"
2023-01-06,"Rupee , worst emerging Asia currency of 2022 , likely to fall further"
2023-01-06,"Indian Rupee , Worst Emerging Asia Currency of 2022 ,  May Have More"
2023-01-06,The G20 and India role in cryptocurrency regulation
2023-01-06,"Indian Rupee , Worst Emerging Asia Currency of 2022 , May Fall Further"
2023-01-07,CBSE Class 10 Social Science Important Questions and Answers : Economics Chapter 3 Money and Credit
2023-01-07,Where is the rupee headed in 2023 ? - The Hindu BusinessLine
2023-01-09,Mercedes - Benz планирует создать свою сеть зарядных устройств для электромобилей
2023-01-09,ЦБ установил официальные курсы валют на 23 декабря
2023-01-09,Rupee at 1 - month high ; US data spurs bets of slower Fed rate hikes
2023-01-10,Rupee gains nearly 100 paise in two days to below 82 against dollar
2023-01-10,Depreciation speculations of Indian rupee waver in new year despite 11 pct fall against USD in 2022 - Xinhua
2023-01-10,"2023 : A year with rate hike , pause & cut ?"
2023-01-10,Pakistan must fasten seat belt as bumpy 2023 ride begins
2023-01-10,"Результаты торгов : валюты растут , особенно евро"
2023-01-11,Transformers and Rectifiers India surges 10 % on healthy growth outlook
2023-01-11,Explainer : How Feasible Is RBI Push to Settle International Trade in Rupees ?
2023-01-11,Depreciation speculations of Indian rupee waver in new year despite 11 pct fall against USD in 2022
2023-01-11,"RBI : Rupee continues winning streak , gains 1 . 5 % in 3 days on foreign flows"
2023-01-11,Губернатор Ставрополья поручил создать горячую линию по оплате ЖКХ
2023-01-12,"Post Market views - Jan 12 , 2023 - Reliance Securities"
2023-01-12,"sensex today : Sensex , Nifty climb ahead of inflation data ; IT stocks gain"
2023-01-12,Курс на укриптение // Новая форма национальной валюты может появиться уже в следующем году
2023-01-12,В РСПП считают перспективным для России использование ЗСТ других стран в условиях санкций
2023-01-12,Глава Иркутской области предложил создать майнинг - зоны по аналогии с игорными
2023-01-12,ETMarkets Smart Talk : 7 things which markets want from Finance Minister in Budget 2023 : Deepak Jasani
2023-01-13,"ETMarkets Smart Talk : Defense , railways among top 6 sectors which will be in focus in Budget 2023 : Sonam Srivastava"
2023-01-13,Rupee registers biggest weekly gain against US dollar in two months
2023-01-13,Internationalisation of the Indian Rupee
2023-01-13,Focus must remain on core inflation : RBI governor Shaktikanta Das
2023-01-14,Knitwear exporters in Tiruppur demand financial support to revive
2023-01-15,"Market outlook : Earnings , macro data among 6 factors to drive D - Street this week"
2023-01-16,"rbi : Rupee held unchanged by portfolio outflows , RBI reservations"
2023-01-16,"India richest 1 % own more than 40 % of total wealth , bottom half of population share only 3 %: Oxfam report"
2023-01-16,Oxfam - India richest one per cent own more than 40 per cent of total wealth : Oxfam
2023-01-16,Know the architects of Union Budget
2023-01-16,В России создадут аналог компании - издателя игр Need for Speed
2023-01-16,Глава Минэнерго предложил создать условия для легального майнинга
2023-01-16,India richest 1 % own more than 40 % of total wealth : Oxfam : The Tribune India
2023-01-16,Sab Changa Si : India richest 1 per cent own more than 40 per cent of country total wealth ! | coastaldigest . com
2023-01-16,"India richest one per cent now own more than 40 per cent of country total wealth , finds new study"
2023-01-16,Аналитик Бовт посоветовал инвестировать средства в валюты дружественных стран
2023-01-16,"Union budget must focus on billionaires , babus & berozgari"
2023-01-16,India richest 1 % own more than 40 % of total wealth : Oxfam - The Hindu BusinessLine
2023-01-16,India Richest 1 % Own More Than 40 % Of Total Wealth : Oxfam
2023-01-16,India most affluent hold 40 % wealth of the economy
2023-01-16,India Richest 1 % Own More Than 40 % Of Country Total Wealth : Report
2023-01-16,oxfam : India richest 1 % own more than 40 % of total wealth : Oxfam
2023-01-16,Аркаим XXI век - концепция геостратегического усиления России и её союзников
2023-01-16,World News | India Richest 1 % Own More Than 40 % of Total Wealth : Oxfam
2023-01-16,India richest 1 % own more than 40 % of total wealth : Study
2023-01-16,FPI : Proposal to ease FPI norms for NRIs back on the table
2023-01-16,Новогодний рубль : каким будет курс валюты в конце 2022 года
2023-01-17,ਭਾਰਤ ਦੇ ਇਕ ਫ਼ੀਸਦ ਅਮੀਰਾਂ ਕੋਲ ਮੁਲਕ ਦੀ 40 ਫ਼ੀਸਦ ਦੌਲਤ
2023-01-17,Know the architects of Union Budget 2023 : Nine individuals who are the brains behind the Union Budget 2023
2023-01-17,Budget India : Get to know the team behind Union Budget 2023
2023-01-17,SWIFT : глобальные расчеты в юанях росли быстрее других валют в ноябре
2023-01-17,"rupee : Bank dollar buys , FPI sales weigh on rupee"
2023-01-17,Rupee slides 0 . 5 % as importers continue to lock in dollar purchases
2023-01-17,India richest 1 % own more than 40 % of total wealth : Oxfam
2023-01-18,В России предложили создать аналог Good Delivery
2023-01-18,"Sensex , Nifty Poised For Flat Open On Muted Asian Cues"
2023-01-19,Металлинвестбанк снижает комиссию за валютные переводы и расширяет линейку валют
2023-01-19,Спрос на курсы экстренной медицинской помощи вырос в России в три и более раза
2023-01-19,Рубль укрепился к основным валютам по итогам среды
2023-01-19,Банк России сообщил о ликвидации еще одного банка
2023-01-19,Курсы доллара и евро на 17 января
2023-01-19,Will debt mutual fund investors get better returns in 2023 ?
2023-01-19,Forbes начинает поиск 30 самых перспективных молодых россиян
2023-01-19,diHouse начинает поставки ноутбуков Rombica
2023-01-20,"Sun Pharma to Acquire Concert Pharmaceuticals , Advancing the Potential Treatment of Alopecia Areata"
2023-01-20,"Банк России сохранил ключевую ставку на уровне 7 , 5 % годовых"
2023-01-20,В Беговом для жителей старших возрастов открылись курсы итальянского
2023-01-20,Премьер Украины Шмыгаль сообщил о планах создать децентрализованную энергосистему
2023-01-20,Центробанк возобновляет операции по покупке иностранной валюты на внутреннем рынке
2023-01-20,India weekly forex reserves rise by $10 . 42 bn to hit 5 - month high of $572 bn
2023-01-20,Benchmarks trade flat ; realty shares fall for 2nd day
2023-01-20,"Sun Pharma to Acquire Concert Pharmaceuticals , Advancing the Potential Treatment of Alopecia Areata - Jammu Kashmir Latest News | Tourism"
2023-01-20,"Sense , Nifty ended flat after a range - bound week - Weekly Closing Report"
2023-01-20,"Sensex falls 236 points to close at 60 , 622 ; HUL , RIL top drags"
2023-01-20,"If you have only one exchange , you have a problem : BSE chief Ramamurthy"
2023-01-20,"Sensex , Nifty fall for 2nd day on global economic slowdown concerns"
2023-01-21,"ETMarkets Smart Talk : Sensex likely to head towards 68K ; IT , pharma may outperform in 2023"
2023-01-21,Курсы доллара и евро на 12 декабря
2023-01-21,Банк России предложил снизить возмещение по вкладам в токсичных валютах
2023-01-21,OCS начинает сотрудничество с Microtek
2023-01-21,"Centre asks YouTube , Twitter to block BBC documentary critical of PM Modi"
2023-01-21,Ставропольские врачи и педагоги провел курсы для медработников в Конго
2023-01-21,SL emerging out of its worst crisis : Ranil reaches out to articulate the art of possibility
2023-01-21,360 - degree discourse on 2023 Budget
2023-01-21,Business News | LTIMindtree Reports Strong Performance in Q3 FY23
2023-01-21,LTIMindtree Reports Strong Performance in Q3 FY23
2023-01-22,FT : Тайвань планирует создать аналог Starlink для защиты от Китая
2023-01-22,ATS mock drill sparks row after  terrorist raise slogans related to a particular community
2023-01-22,ЦБ объяснил декабрьское падение курса рубля снижением продаж валюты экспортеров
2023-01-23,Anatomy of sovereign insolvency of Sri Lanka
2023-01-23,Евро и доллар подросли : ЦБ РФ установил курс валют на утро 19 января
2023-01-23,Минсельхоз предложил не отменять деление земель по целевому назначению
2023-01-23,Аналитик : Для создания общей валюты Бразилии и Аргентине потребуются десятки лет
2023-01-23,Байден признался в подлости США по отношению к другим странам
2023-01-23,India plans to cut gold import duty to arrest smuggling
2023-01-23,ETMarkets Smart Talk : Top 4 sectors likely to stay in focus in Budget 2023 : Mrinal Singh
2023-01-23,"Путин подписал закон , расширяющий перечень валютных операций между резидентами России"
2023-01-23,"India expected to reduce gold import duty to curb smuggling , government officials"
2023-01-23,India expected to cut gold import duty to sideline smugglers
2023-01-23,Pakistan has no money to hold elections ? 10 worrisome economic indicators
2023-01-23,"Sensex , Nifty open stronger , snap two - day losing run"
2023-01-23,"Domestic markets open stronger , snap two - day losing run"
2023-01-23,Avalon Technologies gets SEBI nod to float IPO - The Hindu BusinessLine
2023-01-23,टाटा मोटर्स ने न्यूयॉर्क स्टॉक एक्सचेंज से अपने शेयर हटाए
2023-01-23,United Kingdom - Tata Steel  studying  British government support package
2023-01-23,Treolan начинает поставки оборудования AET
2023-01-24,Ajay Srivastava : We do not expect any tax cut in this Budget : Ajay Srivastava
2023-01-24,"Биткойн привлекает внимание , поскольку Бразилия и Аргентина обдумывают создание общей валюты"
2023-01-24,India said to likely peg FY24 nominal GDP growth at about 11 % in Budget
2023-01-24,Курсы доллара и евро на 11 декабря
2023-01-24,"В  ВТБ  сообщили , что более трети россиян стали реже интересоваться курсами валют"
2023-01-24,India may fix nominal GDP growth at about 11pc in 2023 - 24 budget
2023-01-24,India may peg nominal GDP growth at about 11 % in 2023 / 24 budget - sources
2023-01-24,Sri Lanka : Sovereign Insolvency – Sri Lanka Guardian
2023-01-24,Centre Likely To Peg Nominal GDP Growth At About 11 % In Budget 2023 : Report
2023-01-24,Sri Lanka : Sovereign Insolvency | Sri Lanka Guardian
2023-01-24,India may peg nominal GDP growth at about 11 % in 2023 / 24 budget : Report
2023-01-24,India May Peg Nominal GDP Growth At About 11 % In 2023 / 24 Budget - Sources
2023-01-24,"Barometers trim gains , Nifty below 18 , 150 mark"
2023-01-24,India may peg nominal GDP growth at about 11 % in upcoming Budget : Sources
2023-01-24,"Tata group firm tata motors confirms delisting from NYSE termination of ADS programme - Business News India - टाटा ग्रुप की इस कंपनी के शेयरों की खरीद - बिक्री हुई बंद , जानिए पूरा मामला"
2023-01-24,"Mint Explainer : T+1 , a milestone for the Indian stock market"
2023-01-25,StockEdge launches India first AI - powered screening mechanism to automatically identify Chart Patterns in different stocks with StockEdge Pro
2023-01-25,Business News | StockEdge Launches India First AI - powered Screening Mechanism to Automatically Identify Chart Patterns in Different Stocks with StockEdge Pro
2023-01-25,"Budget 2023 : Investors Expect Centre To Focus On Tax Structure Reforms , Fiscal Consolidation"
2023-01-25,"Latest News | Stock Market Investors Expect Balanced Budget , Focus on Job Creation , Infra Spending"
2023-01-25,"Stock market investors expect balanced budget , focus on job creation , infrastructure spending"
2023-01-25,Stock market holidays 2023 : NSE and BSE will remain closed on these 15 days
2023-01-25,"Stock investors expect Budget to focus on job creation , infra spending"
2023-01-25,"Adani Enterprises FPO launched 27 January will invest on discount share price gmp 100 rupees - Business News India - डिस्काउंट पर मिलेगा अडानी ग्रुप का यह शेयर , 27 जनवरी से आप लगा सकेंगे दांव , ₹100 है ग्रे मार्केट में भाव"
2023-01-25,ЦБ установил официальные курсы валют на 14 января
2023-01-25,Эксперт : появление новой универсальной валюты позволит ускорить отказ от доллара в мире
2023-01-25,ЦБ установил официальные курсы валют на 31 декабря
2023-01-25,В Банк России направили письмо с просьбой продлить льготную ипотеку на коттеджи
2023-01-25,Курсы доллара и евро на 18 января
2023-01-25,"Nifty hovers near 17 , 900 ; Adani Ports tumbles over 6 %"
2023-01-25,"Stock market investors expect balanced budget , focus on job creation , infra spending"
2023-01-25,"Adani Enterprises FPO : Who can subscribe , lot size , price , GMP , other details"
2023-01-25,"Sensex drops 774 pts , Nifty ends below 17 , 900 ; VIX jumps 7 . 30 % to 14 . 66"
2023-01-25,"Futures Slide On Ugly Microsoft Outlook , Renewed War Escalation Fears"
2023-01-25,"Stock market investors expect balanced budget , focus on job creation , infra spending - Jammu Kashmir Latest News | Tourism"
2023-01-25,"Budget 2023 : Hope there isnt any tinkering with capital gains tax , said Devarsh Vakil of HDFC Sec"
2023-01-25,"Rupee edges higher on soft dollar , traders eye inflows"
2023-01-25,"Rupee rises on likely dollar inflows , gains in Asian peers"
2023-01-25,"Private banks post 31 . 7 % YoY growth in Q3 , net profit rises to Rs 35 , 166 cr"
2023-01-25,Barometers end with steep cuts ; Adani Group stocks witness sharp sell - off
2023-01-26,ЦБ установил официальные курсы валют на 25 января
2023-01-26,В Белоруссии назвали агрессивным по отношению к ОДКБ шагом создание пехотной дивизии Польшей
2023-01-26,Словакия получила исключение из санкционной политики ЕС по отношению к российской нефти
2023-01-26,Центробанк сегодня начнет закупки валюты в рамках бюджетного правила
2023-01-26,Курсы по подготовке к ЕГЭ от МарГУ
