Date,Headline
2022-09-28,"Stock Market India : Sell - Off In Nifty , Sensex Extends To Sixth Straight Day , More Pain Ahead"
2022-09-28,"India FX reserves set to shrink further , stir memories of 2008 crisis : Poll"
2022-09-28,Hawkish Fed may prompt India RBI to deliver a 50 - basis - point hike
2022-09-28,"Forex Reserves Set To Shrink Further On Record Low Rupee , Stir Memories Of 2008 Crisis : Report"
2022-09-28,"India forex : India forex reserves set to shrink further , stir memories of 2008 crisis - Reuters Poll"
2022-09-28,"India forex reserves set to shrink further , stir memories of 2008 crisis"
2022-09-28,Rupee within touching distance of 82 / $1 as Fed talks up rate hikes
2022-09-28,rbi : RBI rate - setting panel begins 3 - day meet ; all eyes on decision
2022-09-28,"Forex reserves set to shrink further , stir memories of 2008 crisis : Report"
2022-09-28,"Indian rupee continues downward spiral , poised to hit 82 units per dollar"
2022-09-28,Rupee trade : Two Russian banks get RBI nod for special vostro account
2022-09-28,"inflation : Banks , rethink your credit pecking order"
2022-09-28,"India forex reserves set to shrink further , stir memories of 2008 crisis | Hellenic Shipping News Worldwide"
2022-09-28,Rupee depreciates to new lifetime low ; stocks decline for sixth day
2022-09-28,"Sensex slips 301 pts , Nifty below 16 , 950 mark , metal stocks lose shine"
2022-09-28,USD / INR monthly futures expiry fuels demand for dollars - traders
2022-09-28,FMCG Stocks | Gas Stocks : Hemang Jani on 5 FMCG and gas stocks to bet on
2022-09-28,"Demand is strong , but data needs to be watched : Shanti Ekambaram , Kotak Mahindra Bank"
2022-09-28,Hawkish Fed may prompt RBI to deliver a 50 - basis - point hike
2022-09-28,Hawkish Fed May Prompt India RBI To Deliver A 50 - basis - point Hike
2022-09-28,"Rupee hits new low , inches towards 82 per dollar on hawkish US Fed policy"
2022-09-28,Hawkish Fed may prompt Reserve Bank to deliver a 50 - basis - point hike
2022-09-28,RBI Mulls Steps to Arrest ₹ Slide
2022-09-28,rupee : RBI mulls steps to arrest rupee slide - The Economic Times
2022-09-28,Hawkish Fed May Prompt RBI To Deliver A 0 . 50 % Hike
2022-09-29,"Sensex shows resilience , up by 400 points"
2022-09-29,"Share Market News Today Live : Sensex trims initial gains , still up over 100 points , Nifty eyes 16 , 900 ; Hindalco , Sun Pharma top gainers"
2022-09-29,मासिक वायदा सौदा निपटान से सेंसक्स - निफ्टी पर दबाव
2022-09-29,"Share Market News : Market returns in early trade , Sensex rises 568 points| business News in Hindi | Share Market News : शुरुआती कारोबार में बाजार ने की वापसी , सेंसेक्स 568 अंक चढ़ा"
2022-09-29,Business News | Sensex Slumps 650 Points from Day High ; Asian Paints Dip 4 . 6 Per Cent
2022-09-29,"Stocks Slide , Ugly Mood Returns As Traders Ask  Did Anything Change"
2022-09-29,Sensex slips for 7th day amid F & O expiry ; RBI policy in focus
2022-09-29,"घरेलू शेयर बाजार में लगातार 7वें दिन भी जारी रही गिरावट , सेंसेक्स 188 अंक और टूटा"
2022-09-29,"Sensex , Nifty advance in early trade , breadth strong"
2022-09-29,Barometers trade flat ; PSU banks outperform
2022-09-29,Markets rebound in early trade amid recovery in global equities
2022-09-29,"शुरुआती कारोबार में बाजार ने की वापसी , सेंसेक्स 568 अंक चढ़ा"
2022-09-29,"Abbott India Ltd spurts 4 . 23 %, up for third straight session"
2022-09-29,Indices on Indian markets snap 6 - day losing streak in early trade
2022-09-29,Stock Market Closing : शेयर बाजार लगातार पांचवें दिन गिरावट के साथ बंद ; निफ्टी और सेंसेक्स लाल निशान में
2022-09-29,"Stock Market India : Sensex , Nifty Recover To Stall Six - Day Losing Streak As Global Stocks Bounce"
2022-09-29,"Market tumbles for 7th day , Sensex slip 188 pts , Nifty ends at 16 , 818 . 10"
2022-09-29,Indian Equities Extend Losses Ahead Of RBI MPC Outcome
2022-09-29,rbi mpc meet : Monetary Policy : How key economic indicators shaped up since MPC August review meet to policy decision tomorrow
2022-09-29,Indices may see gap - up opening
2022-09-29,"Indices trade with minor cuts , IT shares decline"
2022-09-29,RBI Monetary Policy : Shaktikanta Das would have to juggle between the devil and the deep blue sea
2022-09-29,Rupee Regains Some Ground From Record Low Despite A Resurgent Dollar
2022-09-29,"rbi policy rate hike : Another hike ! RBI rate - setting panel likely to raise policy rate by 50 bps , shift stance to neutral"
2022-09-29,Rupee Recovers Slightly Against US Dollar RBI Intervention Arrests Slide
2022-09-29,How much should India prop up the rupee ? | The Hindu Parley podcast
2022-09-29,"Letters to the Editor dated September 29 , 2022 - The Hindu BusinessLine"
2022-09-29,How much should India prop up the rupee ?
2022-09-29,"Indian markets end flat : Sensex down 188 pts , Nifty down 41 points"
2022-09-29,"rate hikes : RBI Das unlikely to go all hawkish despite global macro woes , says Sanctum Wealth Hemang Kapasi"
2022-09-29,"Rupee Recovers From Record Low , Reflecting A Broader Relief Rally In Risk Assets"
2022-09-29,Indian refiners pay dollars for Russian oil after dirham attempts fail
2022-09-29,"Stock Market Opening Today ; सहा दिवसांच्या घसरणीला ब्रेक ; शेअर बाजाराची तेजीने सुरुवात , सेन्सेक्स - निफ्टी वधारले"
2022-09-29,RBI Heads For Its Third Half - Point Hike As Rupee Slumps To Record Lows
2022-09-29,rbi mpc meeting : These 5 questions are likely to form the core of RBI MPC meeting . Decision to be out tomorrow
2022-09-29,Sensex slumps 650 points from day high ; Asian Paints dip 4 . 6 per cent
2022-09-29,"Inflation | India Currency : Inflation , weak currency … we are not out of the woods yet : Mitul Kotecha"
2022-09-29,stock market strategy : ETMarkets Smart Talk : Want to time the market ? Consider Balance Advantage Funds : Suresh Soni
2022-09-29,rbi credit policy : RBI has space to hike rates in only Sept and Dec meetings : Pranjul Bhandari
2022-09-29,"Reserve Bank of India ( RBI ) - Government slashes market borrowing target for FY23 by Rs 10 , 000 crore"
2022-09-29,Rupee tipped to recover as U . S . yields fall on BoE decision
2022-09-29,reserve bank of indias : India heads for its third half - point hike as rupee slumps
2022-09-29,RBI to hike repo rate by 50 bps for 3rd time in a row as rupee slumps
2022-09-29,India Heads for Its Third Half - Point Hike as Rupee Slumps
2022-09-29,"US economy , geopolitics : Factors that could roil markets next quarter"
2022-09-29,"bank nifty : D - Street indices extend slide , decline nearly 1 %"
2022-09-29,stock market strategy : Want to time the market ? Consider Balance Advantage Funds : Suresh Soni
2022-09-29,Stock market - Markets settle lower for 7th day ; Sensex declines over 188 points
2022-09-30,DC Edit | Relief from inflation unlikely
2022-09-30,Rupee ends volatile week on strong note after RBI raises rates
2022-09-30,State Bank of India ( SBI ) - Reserve Bank of India hikes repo rate by 50 basis points
2022-09-30,"India hikes rates to tame stubbornly high inflation , analysts see more tightening"
2022-09-30,RBI does not have fixed dollar : rupee exchange rate : Governor ( Ld )
2022-09-30,"More rate hikes , eye on rupee : How experts interpret RBI 50 - bps rate hike"
2022-09-30,"India Cenbank Hikes Rate By 50 Bps , Warns Of Broadening Price Pressures"
2022-09-30,Industry reactions to RBI increase in repo rates
2022-09-30,India key policy rate raised by 50 bps as widely predicted
2022-09-30,"India RBI Delivers Half - Point Hike To Rein in Inflation , Rupee"
2022-09-30,"India RBI Hikes Rates by 50 Bps , Trims GDP Forecast By Investing . com"
2022-09-30,RBI Monetary Policy LIVE UPDATES : RBI Hikes Key Lending Rate By 50 Basis Points To 5 . 9 %
2022-09-30,RBI rate setting panel starts deliberations ; decision on Friday
2022-09-30,RBI keeps inflation projection for FY23 unchanged at 6 . 7 % on upside risks to food prices
2022-09-30,"RBI Monetary Policy : RBI Hikes Rates To 3 - Year - High Of 5 . 9 %, Cites Bleak Global Outlook"
2022-09-30,RBI hikes repo rate by 50 bps to 5 . 9 % for 4th time in a row
2022-09-30,Will Indian rupee fall stop after RBI interest rate hike to 5 . 90 %?
2022-09-30,rbi repo rate hike news : Reserve Bank of India raises repo rate by 50 bps ; continues with withdrawal of  accommodative  stance
2022-09-30,RBI Repo Rate Hike | EMI : With RBI repo rate hike EMI to rise again ; Why you may live longer in debt
2022-09-30,RBI Monetary Policy Live Updates : RBI hikes repo rate by 50 bps to 5 . 9 % for 4th time in a row
2022-09-30,STOCKS INDE - Les actions indiennes sont en baisse avant les résultats de la politique de la RBI .
2022-09-30,RBI Monetary Policy Live Updates : Shaktikanta Das to announce MPC statement today
2022-09-30,RBI Monetary Policy LIVE : Guv likely to raise repo rate by 50 bps to 5 . 9 %
2022-09-30,"RBI hikes repo rate by 50 bps to 5 . 90 %; home , car loans to be impacted"
2022-09-30,Repo Rate Hike Experts React - BW Businessworld
2022-09-30,central bank : India central bank encouraging state refiners to cut spot dollar buying : Sources
2022-09-30,RBI hikes repo rate by 50 basis points – THE INDIAN AWAAZ
2022-09-30,India again hikes rates on  bleak  global outlook
2022-09-30,economy : That synching feeling with central banks
2022-09-30,"Experts fear rate hike may dampen consumption , express optimism over resilient economy"
2022-09-30,Reserve Bank of India ( RBI ) - EMIs to rise as Reserve Bank of India hikes interest rate again
2022-09-30,India central bank hikes interest rates to tame inflation | Business and Economy News
2022-09-30,Editorial . Along expected lines - The Hindu BusinessLine
2022-09-30,"India central bank hikes key rate by 50 bps , warns of rising price pressures"
2022-09-30,"Sensex , Nifty stage a stellar recovery after RBI rate hike ; banking stocks lead gains"
2022-09-30,"India Central Bank Lifts Rates Again To Battle Inflation , Rupee Weakness"
2022-09-30,Welcome To IANS Live - BUSINESS - Disciplined Confidence : RBI Policy September 2022
2022-09-30,Welcome To IANS Live - LatestNews - Disciplined Confidence : RBI Policy September 2022
2022-09-30,Rupee gains on report of RBI nudging oil firms to reduce dollar buys
2022-09-30,Indian Equities Snap 7 day Losing Streak As RBI s Commentary Lifts Investor Sentiment
2022-09-30,EMIs to rise as RBI hikes interest rate again
2022-09-30,Disciplined Confidence : RBI Policy September 2022
2022-09-30,"Asian FX climbs on subdued dollar , stocks slump on growth woes | Hellenic Shipping News Worldwide"
2022-09-30,RBI Hikes Benchmark Repo Rate by 50 Basis Points to 5 . 9 %
2022-09-30,"Rupee Gains Significantly , Boosted By RBI Rate Hike And A Softer Dollar"
2022-09-30,"RBI encouraging IOC , other state refiners to cut spot dollar buying"
2022-09-30,"RBI Guv Shaktikanta Das sounds an optimistic note , says Rupee doing well than its peers"
2022-09-30,Rupee depreciation : Indian start - ups and VCs worried as Fed goes hawkish on the greenback
2022-09-30,EMIs start rising as RBI ups key rate 50bps ; fourth hike in five months
2022-09-30,"RBI raises repo rate by 50 basis points to 5 . 9 % to control inflation , reduces GDP forecast to 7 %"
2022-09-30,Highlights of RBI monetary policy – THE INDIAN AWAAZ
2022-09-30,Currency - Rupee rises 37 paise to close at 81 . 36 against US dollar as RBI raises rates by 50 bps
2022-09-30,Sensex and Nifty 50 make huge gains as RBI hikes repo rate
2022-09-30,Rupee rises 37 paise to close at 81 . 36 against US dollar as RBI raises rates by 50 bps
2022-09-30,Kanpur - based Lohia Corp files IPO papers with SEBI
2022-09-30,Kanpur - Based Lohia Corp Files Initial Public Offering Papers With SEBI
2022-09-30,Rupee rises 33 paise to close at 81 . 40 against US dollar as RBI raises rates by 50 bps
2022-09-30,"RBI rate hike to increase EMIs ; equity , forex markets give thumbs up"
2022-09-30,Rupee rises 37 paise to close at 81 . 36 against U . S . dollar as RBI raises rates by 50 bps
2022-09-30,"Stock Market India : Sensex Surges Over 1 , 000 Points , Stalling A Seven - Day Losing Streak After RBI Hikes Rates"
2022-09-30,Bounce In Futures Fizzles As Dollar Surge Returns
2022-09-30,"Sensex , Nifty rebound after 7 - day fall ; surge after RBI rate hike"
2022-09-30,"Nifty , Sensex Decline 3 weeks in a row – Weekly closing report"
2022-09-30,India equity market dominance is susceptible - The Hindu BusinessLine
2022-09-30,"बिजनेस स ? टैंडर ? ड - रीपो रेट बढ़ने के बाद शेयर बाजार में लौटी रौनक , सेंसेक्स में 1016 अंकों का उछाल"
2022-09-30,"Sensex surges 1 , 200 points as RBI hikes repo rate 50 bps on expected lines"
2022-09-30,"Stock Market Closing : रेपो रेट हाइक के बाद जमकर हुआ कारोबार , सेंसेक्स 1016 अंक चढ़ा , निफ्टी 17 , 100 के करीब"
2022-09-30,"Nifty above 17 , 100 level , metal stocks advance"
2022-09-30,Adani Green Energy up 20 % on heavy volume ; exchange data shows block deal
2022-09-30,"Market at day high ; Nifty above 17 , 000 ; VIX slides over 6 %"
2022-09-30,"Highlights ! Stock Market Today : Indices snap 7 - day losing streak ; Sensex jumps 1000 points , Nifty settles around 17100"
2022-09-30,multibaggers : ETMarkets Smart Talk : Poonam Tandon on top 6 sectors which could produce next set of multibaggers
2022-09-30,Market may open lower ; RBI policy outcome awaited
2022-09-30,"Stock Market Opening : मौद्रिक नीति के ऐलान के बाद हरे रंग में भारतीय बाजार , निफ्टी 17 , 800 के ऊपर"
2022-09-30,"માર્કેટની માઠી શરૂઆત : 170 પોઈન્ટના કડાકા સાથે ખૂલ્યો સેન્સેક્સ , RBI રેપો રેટને લઈને કરી શકે છે મોટું એલાન | The stock market got off to a weak start on the last trading day of the week ."
2022-09-30,"Indian equities snap 7 - day losing streak ; Sensex surges 1 , 017 points"
2022-09-30,"Share Market News Today Live : Indices pause 7 - day losing run , Sensex up over 450 points ; Nifty tops 16 , 950 ; bank , financial climb after RBI rate hike"
2022-09-30,"Stock Market India : Sensex Surges Over 1 , 000 Points To Reverse Earlier Losses After RBI Rate Hike"
2022-09-30,"Adani Green Energy shares zoom 20 %, recover after seven sessions"
2022-09-30,Rupee rises 24 paise to 81 . 49 against U . S . dollar
2022-09-30,Rupee rises 24 paise to 81 . 49 against US dollar
2022-09-30,rupee price today : Rupee rises 24 paise to 81 . 49 against US dollar
2022-09-30,Rupee rises 24 paise to 81 . 49 against US dollar in early trade
2022-09-30,"Stock Market India : Sensex , Nifty Fall Ahead Of RBI Policy Decision , Extend Losses For Eight Straight Days"
2022-09-30,"அதானி க்ரீன் , இந்தியா சிமென்ட்ஸ் பங்குகள் 10 சதவீதத்திற்கு மேல் உயர்வு !"
2022-10-01,"Markets : Markets give a thumbs - up to RBI stance , snap 7 - Day losing streak"
2022-10-01,"Markets Give a Thumbs - up to RBI Stance , Snap 7 - Day Losing Streak"
2022-10-01,World News | Pakistan Love - hate Relationship with IMF Continues Amid Economic Woes
2022-10-01,Spillover Effects of the US Federal Reserve Rate Hike
2022-10-01,repo rate : RBI raises repo rate by 50 bps more to 5 . 9 %
2022-10-01,Here are the latest updates and the big news stories to follow today
2022-10-01,"Sensex , Nifty : Factors thatll influence market next week and the IPO to watch out"
2022-10-01,11 small - cap stocks rise more than 10 % during the week despite weak market sentiment
2022-10-01,Dwindling Foreign Exchange Reserves
2022-10-01,"India defers tax levy on unblended , dirtier fuel amid rising prices"
2022-10-01,Weekender Asia stock market outlook - Asian FX climbs on subdued dollar but stocks slump on growth woes
2022-10-01,"India defers tax levy on unblended , dirtier fuel amid rising prices By Reuters"
2022-10-01,India raises key interest rate by 50 basis points
2022-10-01,Funding Winter : Indian Startup Funding Drops 82 % In Q3 To Reach 2020 Levels
2022-10-01,RBI well tackled challenges to balance growth and inflation
2022-10-03,"Top Headlines : PM Gati Shakti plan , broad - based rules for PE / VCs , and more"
2022-10-05,Airlines can get up to 100 per cent of loan under ECLGS - The Hindu BusinessLine
2022-10-05,Modified ECLGS : SpiceJet hopes to get Rs 1000 cr ; CMD says  settles survivability debate once and for all
2022-10-06,Government amends credit scheme to help airlines stay afloat
2022-10-07,Five export sectors to get power at Rs19 . 9 / unit : Dar
2022-10-07,India RBI Plans Phased Launch of Central Bank Digital Currency
2022-10-08,"With Inflation and National Debt High , Taxing the Rich Looks Attractive"
2022-10-10,Funds mismatch under new settlement process may invite stricter Sebi norms
2022-10-13,Noida - based LED lighting solutions IKIO Lighting Limited files DRHP for IPO
2022-10-13,Infosys : Broad based growth in H1 of 20 . 1 % in constant currency ; Q2 margins expand 150 bps sequentially ( 2 )
2022-10-13,Tracxn Tech Retail Book Fully Subscribed on Day 1
2022-10-13,Infosys : Broad based growth in H1 of 20 . 1 % in constant currency ; Q2 margins expand 150 bps sequentially ( 1 )
2022-10-13,Rupee falls 5 paise to close at 82 . 38 against US dollar - The Hindu BusinessLine
2022-10-13,"Nifty , Sensex Remain Under Pressure – Thursday Closing Report"
2022-10-13,Rupee falls 5 paise to close at 82 . 38 against US dollar
2022-10-13,"Sensex slides 391 pts , Nifty holds 17k ; banks drag"
2022-10-13,"Stock Market India : Sensex , Nifty Fall Over 0 . 6 % On Global Gloom , A Day After A Sharp Rally"
2022-10-13,Currency - Rupee trades in narrow range against US dollar in opening trade
2022-10-13,Rupee falls 5 paise to close at 82 . 38 against US dollar - Jammu Kashmir Latest News | Tourism
2022-10-13,Rupee falls 5 paise to close at ₹82 . 38 against U . S . dollar
2022-10-13,Currency - Rupee falls 5 paise to close at 82 . 38 against US dollar
2022-10-13,Tracxn Tech Retail Book Subscribed 2 . 60 times on Day 2
2022-10-13,"Barometers end with modest losses ; Nifty settles near 17 , 000 ; Wipro slumps 7 %"
2022-10-14,Infosys : Broad based growth in H1 of 20 . 1 % in constant currency ; Q2 margins expand 150 bps sequentially
2022-10-14,"Markets rebound sharply amid heavy buying in IT stocks , firm global trends"
2022-10-14,"Nifty , Sensex May Trend Higher – Weekly closing report"
2022-10-14,Markets rebound sharply amid firm global trends ; Sensex jumps 684 points
2022-10-14,"Sensex , Nifty gain over 1 % amid firm global trends - The Hindu BusinessLine"
2022-10-14,Tracxn Tech IPO oversubscribed by 2 . 01 times on final day ; Retail portion booked 4 . 87 times
2022-10-14,"Stock Market India : Sensex , Nifty Jump Over 1 % On Global Stocks Rally Despite Economic Gloom"
2022-10-14,Indices drift higher in early trade amid strong global cues
2022-10-14,"China Stocks Jump Before Party Congress , Aiding Big Asia Rally"
2022-10-14,"Sensex , Nifty rebound sharply amid firm global trends"
2022-10-14,"Beware ! These risks may drag Sensex , Nifty lower"
2022-10-14,Everstone Capital Mulling Selling Stake Worth $314 Mn In Restaurant Brands Asia : Report
2022-10-14,"Tracxn Technologies : Allotment Of Shares Of This Ipo May Happen Next Week , Know What Is Gmp ? - Tracxn Technologies : अगले हफ्ते हो सकता है इस आईपीओ के शेयरों का अलाॅटमेंट , जानें क्या है जीएमपी ?"
2022-10-14,"Markets rebound sharply amid firm global trends ; Sensex climbs 1 , 087 points"
2022-10-14,"Stock Market India : Sensex Rallies Over 1 , 000 Points To Above The 58 , 000 Mark , But Risks Remain"
2022-10-15,Infosys : Broad based growth in H1 of 20 . 1 per cent in constant currency ; Q2 margins expand 150 bps sequentially
2022-10-16,"Top news of the day : October 16 , 2022"
2022-10-17,Stock Market India : Sensex Opens In The Red As Global Financial Conditions Tighten
2022-10-17,"electronics mart ipo , Electronics Mart स्टॉक लिस्टिंग ; गुंतवणूकदारांना कमाईची संधी , GMPमध्ये चांगला प्रतिसाद - electronics mart india ipo listing today what gmp grey market premium signals"
2022-10-17,Ajanta Pharma awarded  India Best Managed Companies  by Deloitte
2022-10-17,Market near day high ; Metal stocks decline
2022-10-17,Markets fall in early trade amid weak global cues
2022-10-17,"hdfc bank : HDFC merger may trigger Nifty rebalancing , $1 . 5 billion outflow"
2022-10-17,Tracxn Technologies IPO : Here how you can check the allotment status
2022-10-17,Excel Realty N Infra to enter renewable power segment through Joint Venture
2022-10-17,Tracxn Technologies IPO share allotment today : Here how to check status
2022-10-17,Electronics Mart Shares Rise Nearly 53 % In Stock Market Debut
2022-10-17,Excel Realty N Infra to Enter Renewable Power Segment through Joint Venture
2022-10-17,Electronics Mart makes strong debut ; lists at 53 % premium over issue price
2022-10-17,Biocon Biologics Out - Licenses Two Biosimilar Assets to Yoshindo for Commercialization in Japan
2022-10-18,Indian Rupee Jumps Against UAE Dirham In Early Trade
2022-10-18,Barometers trade with strong gains ; pharma shares rise for 5th day
2022-10-18,Plaza Wires received SEBI nod to raise funds via IPO
2022-10-18,Electronics Mart India Ltd makes electrifying debut
2022-10-18,Markets rally for 3rd day amid firm global trends ; Sensex up 549 points
2022-10-18,Markets rally for 3rd day amid firm global trends ; Sensex jumps 549 points
2022-10-18,"Markets rally for 3rd day amid positive global trends ; RIL , banking stocks spurt"
2022-10-18,"Sensex closes 549 points higher to extend rally into 3rd day , Rupee loses 7 paise"
2022-10-18,"ZEE Entertainment jumps 6 % amid Rs 1 , 396 crore block deals"
2022-10-18,Indian rupee jumps against UAE dirham in early trade
2022-10-18,Markets rally in early trade amid firm global markets
2022-10-18,"Benchmark indices open in positive trade , Sensex climbs to 626 points"
2022-10-18,"Sensex climbs 626 points to 59 , 036 . 66 in early trade ; all firms trade in green"
2022-10-18,Piramal Pharma to list on bourses on October 19 after demerger
2022-10-18,Markets rally for 3rd day amid firm global trends
2022-10-18,"Markets rally for 3rd day amid firm global trends , Sensex jumps 549 points"
2022-10-19,Piramal Pharma Limited lists on BSE and NSE
2022-10-19,Rupee falls below 83 versus dollar
2022-10-19,Rupee falls below 83 mark for first time against US dollar
2022-10-19,"piramal pharma : Piramal Pharma lists share on BSE , NSE"
2022-10-19,"STAR Housing Finance Limited , a rural focused home finance company posts record H1 results"
2022-10-19,Piramal Pharma lists at ₹201 . 80 per share on BSE - The Hindu BusinessLine
2022-10-19,Benchmarks come off the day high ; realty stocks in demand
2022-10-19,Markets continue to rally for 4th consecutive day in early trade
2022-10-19,Piramal Pharma drops 5 % after listing at Rs 201 . 80 ; Motilal sees Rs 210 as fair value
2022-10-19,Markets rally for third day amid positive global trends
2022-10-19,Stock Market India : Sensex Rises Nearly 150 Points To Extend Rally For The Fourth Straight Day
2022-10-19,"Sensex , Nifty continue to rally for 4th consecutive day in early trade"
2022-10-20,Welcome To IANS Live - LatestNews - Diwali Muhurat Trading : Invest in WealthBaskets for long - term wealth creation
2022-10-20,Welcome To IANS Live - SCIENCE - AND - TECHNOLOGY - Diwali Muhurat Trading : Invest in WealthBaskets for long - term wealth creation
2022-10-20,Tracxn Technologies climbs 18 per cent on listing day - The Hindu BusinessLine
2022-10-20,Muhurat Trading Picks 2022 by Top Stock Brokers
2022-10-20,Business News | Weak Stock Market Debut for Tracxn Technologies with 6 Per Cent Premium
2022-10-20,Which stocks should you bet on in Samvat 2079 ?
2022-10-20,Welcome To IANS Live - BUSINESS - Diwali Muhurat Trading : Invest in WealthBaskets for long - term wealth creation
2022-10-20,"Sensex slides 151 pts , bank stocks under pressure"
2022-10-20,Stock Market India : Sensex Reverses Early Losses To Gain Nearly 100 Points To Extend Its Rally For Fifth Straight Day
2022-10-20,Diwali Muhurat Trading : Invest in WealthBaskets for long - term wealth creation
2022-10-20,"Barometers rises for 5th day , Nifty settles at 17 , 563 . 95 , IndusInd Bank slides over 4 %"
2022-10-20,Stock Market India : Sensex Falls Over 200 Points To Stall A Four - Day Rally On Global Sell - Off
2022-10-20,Barometers pare most losses ; IT shares in demand
2022-10-20,"Nifty above 17 , 500 ; European shares decline ; Rupee hits fresh record low"
2022-10-20,Rupee opens at all - time low of 83 . 06 against US dollar
2022-10-20,Piramal Pharma Limited Lists on BSE and NSE
2022-10-21,Ebix Reaffirms Strong Business Outlook and Announces
2022-10-21,"Futures Slide As Global Yields Soar , Pushing Bond Markets To Edge Of Breaking"
