Date,Headline
2023-02-26,Расширен перечень индикаторов риска нарушения обязательных требований по федеральному государственному экологическому контролю
2023-02-26,Новый рывок доллара : ЦБ РФ установил курс валют на 8 февраля
2023-02-26,Further tightening could push growth down to 5 %: MPC member Ashima Goyal
2023-02-26,India Inc external borrowings down 15 % in 9M FY23 - The Hindu BusinessLine
2023-02-26,Adding Adani firms in 14 NSE indices raises worry
2023-02-26,« НОВАТЭК » и индийская госкомпания GAIL могут подписать договор о поставках газа
2023-02-26,"ФАС подтвердила возможность заключения мировых соглашений с  Северсталью , НЛМК и ММК"
2023-02-26,Минздрав : перечень жизненно необходимых лекарств будет расширен
2023-02-26,जीडीपी और वाहन बिक्री के आंकड़ों का बाजार पर रहेगा असर
2023-02-26,GDP और वाहन बिक्री के आंकड़ों का बाजार पर रहेगा असर - gdp and vehicle sales figures will affect the market
2023-02-26,Nine of top 10 firms lose ₹1 . 87 lakh crore in market valuation
2023-02-27,Rupee Closes At 82 . 84 Per US Dollar On Fed Policy Bets
2023-02-27,Rupee recovers from 82 . 95 per dollar on likely heavy USD sales by RBI
2023-02-27,Will the bet on private investment pay off ?
2023-02-27,В правительстве Брянской области обсудили выполнение программы « Цифровая экономика »
2023-02-27,Investors Dump Shares For Seventh Straight Session As Bond Yields Surge To Three - Month High
2023-02-27,Stocks that bucked muted market trend during week ended February 24
2023-02-27,Market may open lower on negative global cues
2023-02-27,"Share Market Today : कमजोर वैश्विक रुख से शुरुआती कारोबार में गिरावट , सेंसेक्स 59000 के नीचे"
2023-02-27,ಬಂಡವಾಳ ಮಾರುಕಟ್ಟೆ | ಎಸ್ಐಪಿ : ₹10 ಕೋಟಿ ಹೂಡಿಕೆ ಹೇಗೆ ?
2023-02-27,"Market slides for 7th day , Nifty ends below 17 , 400 ; IT , metal shares drag"
2023-02-27,"शेयर बाजार में लगातार सातवें दिन गिरावट , सेंसेक्स 175 अंक और टूटा"
2023-02-27,सेंसेक्स शुरुआती कारोबार में 355 अंक टूटा - pti maharashtra story
2023-02-27,Stock Market Sectors : Stock market update : FMCG stocks down as market falls
2023-02-27,शेयर बाजार में गिरावट जारी
2023-02-27,"Benchmarks end wit modest losses ; Nifty settles below 17 , 400"
2023-02-27,Indian stock indices continue to slide on weak fundamentals
2023-02-27,Share Market : Sensex lost 355 points in early trade| business News in Hindi | Share Market : सेंसेक्स शुरुआती कारोबार में 355 अंक टूटा
2023-02-27,"upper circuit in penny stocks , घसरणीच्या शेअर बाजारात हे पेनी स्टॉक अप्पर सर्किटमध्ये पोहोचले - these penny stocks are locked in the upper circuit today"
2023-02-27,Broader markets extend underperformance ; auto shares fall for 5th day
2023-02-27,"Share Market Opening : शेअर बाजारात पुन्हा मंदी , सेन्सेक्स , निफ्टी कोसळले ! असे आहेत जागतिक संकेत - share market opening today sensex falls 200 points and nifty 50 below 17 , 400"
2023-02-27,Marico Share Price : Marico shares drop 2 . 01 % as Sensex falls
2023-02-27,rupee rate today : Rupee falls 19 paise to 82 . 94 against US dollar
2023-02-27,"Market falls for 7th straight day ; Nifty settles below 17 , 400 ; Bajaj Auto slips 5 . 43 %"
2023-02-27,Rupee falls 19 paise to 82 . 94 against dollar early trade
2023-02-27,"Sensex , Nifty log longest losing run in 5 months"
2023-02-27,"ORCA , India first one - stop platform for learning , analyzing , and investing in Capital Markets , Launched"
2023-02-27,"Sensex , Nifty fall for 7th day on the trot on global equity losses"
2023-02-27,"Nifty , Sensex Trying to Put in Rally - Monday Closing Report"
2023-02-27,"Share India Securities Ltd approves Terms of Rights Issue , Company added to MSCI Domestic Small Cap Index"
2023-02-27,"Sensex , Nifty close in red for 7th straight session on weak global trends"
2023-02-27,Rupee falls 19 paise to 82 . 94 against U . S . dollar
2023-02-27,Inclusion of Adani firms in multiple NSE indices raises concern
2023-02-27,"Sensex , Nifty End Lower For Seventh Straight Day As IT Stocks Tumble"
2023-02-27,"Business News | Share India Securities Ltd Approves Terms of Rights Issue , Company Added to MSCI Domestic Small Cap Index"
2023-02-27,Indian Rupee Opens Lower Against UAE Dirham On First Trading ...
2023-02-27,Rupee falls 19 paise to 82 . 94 against US dollar on muted domestic equities
2023-02-27,Currency - Rupee falls 19 paise to 82 . 94 against US dollar in early trade
2023-02-27,"LIC extends losing streak to 7th straight session , hits record low"
2023-02-27,Indian rupee opens lower against UAE dirham on first trading day of the week
2023-02-27,"Stock market - Sensex , Nifty close in red for 7th straight session on weak global trends"
2023-02-27,InterGlobe Share Price : InterGlobe shares drop 0 . 8 % as Sensex falls
2023-02-28,D - Street Indices Fall for Seventh Straight Session
2023-02-28,D - Street : D - Street indices fall for seventh straight session
2023-02-28,Broader markets outperform ; consumer durable stocks in demand
2023-02-28,ACC Share Price : ACC shares gain 1 . 79 % as Sensex rises
2023-02-28,"शेयर बाजार में लगातार आठवें दिन गिरावट , चार माह के निचले स्तर पर"
2023-02-28,"Stock Markets : Sensex , Nifty post eighth straight fall in longest losing streak in 4 years"
2023-02-28,"Stock market today falls for 8th straight day , Nifty below Budget day low"
2023-02-28,"Stock market - Sensex falls over 326 points to settle at four - month low of 58 , 962 , Nifty dips to 17 , 303"
2023-02-28,"शेयर बाजार में रही लगातार 8वें दिन भी गिरावट , सेंसेक्स 59 , 000 अंक से नीचे फिसला"
2023-02-28,Stock markets end lower for 8th day on the trot as bears tighten grip
2023-02-28,Indices may open flat ; global stocks advance
2023-02-28,"शेयर बाजार में गिरावट जारी , सेंसेक्स और निफ्टी आधी फीसद लुढ़का"
2023-02-28,"Snapping seven straight session losses , Indian stocks rise marginally Tuesday"
2023-02-28,Power Grid Corporation of India Ltd gains for third straight session
2023-02-28,"Market near day low ; Nifty below 17 , 400 ; oil & gas shares decline"
2023-02-28,Share Market Opening : बाजाराची सपाट सुरुवात ; सेन्सेक्स तेजीत तर निफ्टी गडगडला
2023-02-28,"प्रमुख कंपनी एंटरप्रायझेसचे समभाग 5 % पेक्षा जास्त घसरले , सेन्सेक्स 200 अंकांनी वाढला | Stock Market Latest update Sensex Nifty Adani Group Total gas"
2023-02-28,The Adani Saga : Wilful Blindness
2023-02-28,"Sensex , Nifty Decline For Eighth Continuous Day Amid Volatility"
2023-02-28,"Sensex , Nifty end lower for 8th day on the trot as bears tighten grip"
2023-02-28,"The stock market fell for the eighth consecutive day , the Sensex slipped below 59 , 000 points . | business News in Hindi | share Market Update : शेयर बाजार में लगातार आठवें दिन गिरावट , सेंसेक्स 59 , 000अंक से नीचे फिसला"
2023-02-28,Мадуро предложил создать блок союзников РФ и КНР в Латинской Америке
2023-02-28,"Retail investor top bets - Bajaj Finance , Adani Ports , RIL : Which stocks are they buying and selling ?"
2023-02-28,Triveni Turbine soars 10 % to hit new high on healthy revenue growth outook
2023-02-28,"Adani Rout , RBI Rate Hikes Wreck Indian Markets In Covid - Like Manner"
2023-02-28,Google спешит : компания начала тестировать на сотрудниках свой аналог чат - бота ChatGPT
2023-02-28,География арендного жилья ДОМ . РФ увеличится до 15 регионов к концу 2025 года
2023-02-28,ЦБ установил официальные курсы валют на 8 февраля
2023-02-28,"В РСТ считают , что котировки новых валют не повлияют на цену путевок"
2023-02-28,Официальные лица в России стали много говорить про мобилизационный резерв . Цитаты
2023-02-28,Donya - e Eqtesad : Россия стала крупнейшим иностранным инвестором в экономику Ирана
2023-02-28,"Выгорание на работе : причины , признаки и как этого избежать"
2023-02-28,Президент Бразилии Лула да Силва предложил создать единые валюты БРИКС и МЕРКОСУР
2023-03-01,"TCS Layoffs : Latest TCS Layoffs News , TCS Layoffs Reason"
2023-03-01,« Телфин » расширил партнерскую сеть на 38 % в 2022 году
2023-03-01,ЦБ предлагает ввести новые подходы к регулированию валютных рисков банков
2023-03-01,Турчак предложил создать условия россиянам для возвращения из - за рубежа
2023-03-01,Иран через российскую межбанковскую систему подключился к 106 иностранным банкам
2023-03-01,Глава Союза добровольцев Донбасса предложил создать новое воинское соединение
2023-03-01,В Подмосковье сотрудницу сотового оператора приговорили к году заключения за нарушение тайны переписки
2023-03-01,РСПП : с полок магазинов могут пропасть биокефир и биойогурт
2023-03-01,"Потолок цен не затронет нефтепродукты , доставленные до 1 апреля 2023 года"
2023-03-01,Биткоин стал дороже $24 500 и достиг двухнедельного максимума
2023-03-01,Отбор газа из ПХГ Евросоюза достиг максимума с середины декабря
2023-03-01,Японские гости ? Импорт автомобилей с пробегом увеличился вдвое
2023-03-01,Агент Карпукаса прокомментировал интерес к полузащитнику « Локомотива » из Франции
2023-03-01,"Власти объявили конкурс на восстановление здания , за которое боролся губернатор"
2023-03-01,Доллар США будет более стабильным в 2023 году после первоначальной слабости в первом квартале
2023-03-01,Эксперт по туризму : единственная проблема горящих путёвок ограниченность выбора направлений
2023-03-01,Anemia and Other Blood Disorder Drugs Global Market Report 2023 : Market Set to Grow to $14 . 80 billion in 2027 at a CAGR of 5 . 7 %
2023-03-01,Центробанк обнаружил схему отмывания денег при помощи инвестиционных монет
2023-03-01,"Евро замедлился , а доллар снова подрос : ЦБ РФ установил курс валют на 4 февраля"
2023-03-01,"Застройщика , обманувшего омских дольщиков , посадили на 2 , 5 года"
2023-03-01,Ввод жилья на Ставрополье увеличился более чем на 10 процентов
2023-03-01,Замороженные активы россиян обеспечили половину годовой прибыли Euroclear
2023-03-01,Moody maintains stable outlook on Indian banks
2023-03-01,Компания EDF получила чистый убыток в 18 млрд евро в 2022 г . из - за приостановок работы АЭС
2023-03-01,Цены на квартиры в новостройках выросли в 2022 году на 21 %
2023-03-01,Онколог спрогнозировал сохранение 300 тыс . жизней за счет вакцинации от ВПЧ
2023-03-01,Cabrera Capital Daily Game Plan
2023-03-01,Путин предложил Совбезу обсудить границу континентального шельфа России
2023-03-01,« Год выдался нелегким . Огорчает отсутствие России на международном уровне » Чен
2023-03-01,"Хетчбэк Lada Granta не стоит ждать в 2023 году , да и позже модель вряд ли вернётся"
2023-03-01,Сунак пообещал продолжить поддержку Украины в 2023 году
2023-03-01,"India GDP Growth Dips In Q3 , But Ahead Of China"
2023-03-01,"Экспорт российского зерна до конца июня 2023 года может достичь 55 – 60 млн тонн , заявил Путин"
2023-03-01,"« Любимчик Вселенной »: Тамара Глоба назвала знак зодиака , у которого все будет в 2023 году"
2023-03-01,МЭА оценило потери России от потолка цен на нефть в январе
2023-03-01,"TeleTrade прогнозирует к лету 75 , 5 рублей за доллар"
2023-03-01,"ЦБ договорился , что банки с 1 квартала начнут раскрывать финотчетность"
2023-03-01,"ОПЕК , Аль - Гайс : мировой спрос на нефть превысит допандемический уровень в 2023 году"
2023-03-01,Расходы США на оборону в 2023 году вырастут почти на 10 %
2023-03-01,Экспорт российской нефти морским путем снизился на 22 % в декабре
2023-03-01,Мировые цены на нефть выросли в ожидании статистики по запасам в США
2023-03-01,В Белоруссии заявили о рекордном экспорте в Россию по итогам года
2023-03-01,Маск в соцсетях оценил шутку о нехватке у французских футболистов энергии из - за России
2023-03-01,ВМС США увеличат мощность и дальность действия своих боевых лазеров
2023-03-01,Какие предсказания для России и Украины сбудутся в этом году
2023-03-01,"Ъ  узнал , что российский экспорт необработанного леса упал на 70 % в 2022 году"
2023-03-01,"Топ - 3 импортеров рыбной продукции России в 2022 году нарастили закупки до 1 , 7 млн тонн"
2023-03-01,В Конгрессе США Зеленский попросил нарастить санкционное давление на Россию
2023-03-01,Дыра в бюджете : от каких знаков зодиака в 2023 году отвернется денежная удача
2023-03-01,Огромного размера : жуткая опухоль разделила жизнь Айзы на до и после
2023-03-01,Около 18 млн туристов посетили Москву в 2022 году
2023-03-01,Во Франции заявили о необходимости увеличить мощность АЭС на 25 %
2023-03-01,"Данни :  Я желаю , чтобы Россия в следующем году вновь могла выступать на международных соревнованиях"
2023-03-01,"В Росатоме заявили , что потребность в судах для Севморпути к 2035 году составит 110 единиц"
2023-03-01,"Нефть дешевеет , в Азии настроения негативные"
2023-03-01,Bloomberg узнал о падении экспорта нефти из России на 54 % в первую неделю эмбарго
2023-03-01,Маркизио рассказал о силе сборной Франции на ЧМ - 2022
2023-03-01,"В Минэкономразвития сообщили об интересе Турции , Индии и Китая к розничному рынку России"
2023-03-01,"ЦБ РФ продал юани на 9 , 1 млрд руб . с расчетами 10 февраля"
2023-03-01,Tagesschau : стоимость бензина в ФРГ показала рекордный рост за 2022 год
2023-03-01,Жительница Медведевского района внезапно стала должна банку 600 тысяч
2023-03-01,Deloitte снизила на два градуса температуру в офисах из - за энергетического кризиса
2023-03-01,ЕЦБ повысил базовую ставку до 3 % годовых
2023-03-01,Специалисты рассказали о перспективах рынка кормов для животных в России
2023-03-01,"gdp : By reading between GDP numbers , the good , bad and ugly about the latest growth estimates"
2023-03-01,На старте торгов рынок демонстрирует слабую динамику
2023-03-01,В Комаричском районе в 2022 году обновили четыре дворовые территории
2023-03-01,No Landing  Scenario Is Just a Pipe Dream for U . S . Economy
2023-03-01,"Учёные назвали растение , у которого есть потенциал для лечения рака"
2023-03-01,"Рыночная капитализация криптовалюты возвращает 1 трлн долларов , поскольку SOL , OKB , APT взрываются двузначными цифрами : выходные"
2023-03-01,Омбудсмен Волынец : дорогая ипотека тормозит рост рождаемости в России
2023-03-01,Moody ups India growth projection for 2023 to 5 . 5 % on higher capex Budget - Jammu Kashmir Latest News | Tourism
2023-03-01,"Goldman Sachs прогнозирует , что акции Китая вырастут на 24 % к концу 2023 года"
2023-03-01,Китайские бренды всё ещё догоняют . Kia сохранила лидерство среди иномарок в России по итогам 2022 года
2023-03-01,Путин заявил о преодолении Россией неожиданных рисков в 2022 году
2023-03-01,В 2022 году Брянщина отправила жителям Донбасса более 1630 тонн необходимых товаров
2023-03-01,Кабмин планирует удвоить выпуск автомобилей в России в ближайшие два - три года
2023-03-01,Производственный календарь . Как отдыхаем и работаем в 2023 году
2023-03-01,"Президент Франции : Меня упрекают за ведение диалога с Россией , но я такой диалог всё равно продолжу"
2023-03-01,Moody Hikes India Growth Projection For 2023 To 5 . 5 % On Higher Capex Budget
2023-03-01,США заявили о поддержке решения Японии приобрести « потенциал контрудара »
2023-03-01,"NYT : администрация США больше знает о военных планах России , чем о замыслах Украины"
2023-03-01,ЮStream : донаты стримерам выросли на 23 % в 2022 году
2023-03-01,Академия единоборств в Сириусе станет основной базой дзюдоистов России
2023-03-01,Глава ФНЛ за возвращение к « весне ‑ осень »: « Самая высокая посещаемость – в августе и сентябре . Самая низкая в октябре и ноябре »
2023-03-01,Володин рассказал о вступающих в силу в новом году законах
2023-03-01,"Аналитики выявили , кто из свердловчан был вынужден чаще искать новую работу в 2022 году"
2023-03-01,"Туроператоры спрогнозировали , насколько подорожает отдых в Турции летом"
2023-03-01,В Twitter предложили постпреду Канады в ООН Рэю идти воевать самому
2023-03-01,В России заявили о приверженности целям ДСНВ
2023-03-01,Генпрокуратура : в 2022 году было совершено рекордное количество экстремистских преступлений
2023-03-01,Индекс PMI обрабатывающих отраслей РФ в декабре незначительно снизился
2023-03-01,"Астролог выделила знак зодиака , который в 2023 году ждет финансовый успех"
2023-03-01,ЦБ разработает модель трансграничных расчетов в цифровом рубле
2023-03-01,В России МРОТ дополнительно проиндексируют на десять процентов
2023-03-01,"В 2022 году доля возвратов похищенных у граждан денег составила 4 , 8 %"
2023-03-01,Газ в Европе дешевеет до $750 за 1 тыс . куб . м
2023-03-01,« Крок » изучила изменение спроса компаний на облачные сервисы в 2022 году
2023-03-01,Bangladesh economic miracle is in jeopardy
2023-03-01,Почти половина омичей сталкивается с « поборами » на работе
2023-03-01,Первый этап Вознесенского тракта откроется для движения в следующем году
2023-03-01,Газпром  начнет промышленную добычу газа на Харасавэе в 2024 году
2023-03-01,Пьющие финны проделали дыру в бюджете страны
2023-03-01,Карякин : FIDE должна осудить Германию за антироссийские шаги
2023-03-01,"Аналитики рассказали , что будет с рублем на фоне роста валютных интервенций"
2023-03-01,Китай перестал публиковать ежедневные данные о коронавирусе
2023-03-01,"Спад ВВП РФ в ноябре замедлился до 4 , 0 % с 4 , 5 % в октябре"
2023-03-01,В Orlen предсказали снижение доли нефти из РФ в импорте Польши до 10 % в 2023 году
2023-03-01,The No Landing Scenario And UFOs
2023-03-01,ЯRUS сохранил « ламповую » атмосферу соцсети и стал еще комфортнее для пользователей за 2022 год
2023-03-01,Россияне неожиданно повысили интерес к Испании
2023-03-01,"Марк Кьюбан говорит , что продолжит покупать больше биткойнов в 2023 году , диверсифицирует криптохолдинги"
2023-03-01,2023 год станет одним из самых жарких в истории
2023-03-01,В России решили создать « Карту туриста » для безналичных расчетов иностранцев
2023-03-01,Россия видит риск снижения добычи нефти в 2023 году
