Date,Headline
2022-02-01,"Budget 2022 : FM makes no big bang announcements , but taxpayers get some relief"
2022-02-01,India crea rupia digital y regulariza transacciones de criptomonedas y NFTs
2022-02-01,"French CPI inflation slowed less than expected , Euro Area employment picture continues to improve"
2022-02-01,India desincentivará la compra de criptos con un impuesto del 30 % a las transferencias
2022-02-01,Crypto tax regime indicates future of cryptocurrencies in I ...
2022-02-01,Budget 2022 : Know what the crypto tax regime indicates about the future of digital assets in India
2022-02-01,Crypto tax regime indicates future of cryptocurrencies in India
2022-02-01,"Union Budget Of India 2022 Burden On Salaried And Middle Class And Tax On Crypto Too : देना एक न लेना दो ... सैलरीड हो या मिडल क्‍लास , इस बजट ने सबकी बैंड बजा दी"
2022-02-01,"Budget 2022 | Swaminathan Aiyar : It is a risk - taking Budget , not populist : Swaminathan Aiyar"
2022-02-01,Budget 2022 : Mixed bag of economy boosters and clarificatory measures
2022-02-01,India anuncia la creación de la rupia digital e impuestos a las criptomonedas | Mercados
2022-02-01,Crypto tax regime indicates future of cryptocurrencies in India - Top Nagaland News Today Get Latest News on Nagas
2022-02-01,India anuncia creación de la rupia digital e impuestos a criptomonedas
2022-02-01,"India Union Budget 2022 - 23 : Key Policy Goals , Announcements"
2022-02-01,"India creó impuesto del 30 % para transferencias virtuales , como las criptomonedas y los NFT"
2022-02-01,Crypto tax regime directs future of cryptocurrencies in India
2022-02-01,"Crypto Tax : Most Industry Insiders Laud India  Regulate Over Restrict  Approach , But Few Concerns Remain"
2022-02-01,"Nifty hovers below 17 , 550 ; India VIX falls 5 . 11 % to 20 . 83"
2022-02-02,"Sensex : Market Watch : With Budget over , what will guide markets now ?"
2022-02-02,"Bombay stock exchange | चौतरफा लिवाली से बाजार में तेजी , सेंसेक्स 696 अंक उछला"
2022-02-02,Finance Minister Nirmala Sitharaman chooses growth with a Budget for India @ 100
2022-02-02,Commerce ministry to soon notify modified interest subsidy scheme : Secretary
2022-02-02,India plans to launch CDBC digital currency
2022-02-02,India Proposes 30 % Tax on Crypto Income Finance Minister Cites  Phenomenal Increase  in Crypto Transactions – Regulation Bitcoin News
2022-02-02,What are the key takeaways from Budget 2022 ?
2022-02-02,"Bitcoin , Ethereum or NFT will never become legal tender : Finance Secretary"
2022-02-02,digital rupee : Rupee to go digital : What Budget CBDC move signals
2022-02-02,"Cryptic no more : Cryptocurrencies , CBDC may get to coexist : Tech News"
2022-02-02,"Budget 2022 : As FM introduces 30 % tax on virtual currency , does it indicate future of cryptocurrencies in India ?"
2022-02-02,"Budget 2022 : A clear push towards a digital economy , start - ups"
2022-02-02,"Отец , сын и Вячеслав Платон . Чем закончился спор униониста Билецкого с TV8"
2022-02-02,Next year ITR to have separate column for crypto income : Revenue Secy
2022-02-03,मुनाफावसूली से शेयर बाजार की तेज रफ्तार पर लगा ब्रेक
2022-02-03,"USD to INR Forecast for 2022 , 2025 , and 2030"
2022-02-03,"Demand for housing to remain robust for a long time , says HDFC Ltd Keki Mistry"
2022-02-04,"India forex reserves fall $4 . 5 billion , worst weekly drop in a year"
2022-02-04,India Inc overseas borrowing jumps 19 per cent to $23 . 28 billion in 9MFY22
2022-02-04,"What is Repo Rate ? Definition of Repo Rate , Repo Rate Meaning"
2022-02-04,बिकवाली की मार से शेयर बाजार बेहाल
2022-02-04,Our challenge was to make a Budget for a very buoyant economy : Nirmala Sitharaman
2022-02-04,La India aplicará impuesto a las criptomonedas
2022-02-05,Will dollar go below crucial level ? - The Hindu BusinessLine
2022-02-06,Personal Finance : Seven takeaways for taxpayers from the Union Budget 2022
2022-02-06,RBI Monetary Policy Meet Postponed To February 8 As Maharashtra Declares Holiday On Monday
2022-02-07,India definition of  virtual digital asset isnt set in stone
2022-02-07,RBI reschedules MPC meet as Maharashtra shut on Lata Mangeshkar death
2022-02-07,RBI may wait for a few months to raise interest rates : Survey
2022-02-07,RBI postpones MPC meet to February 8 as Maharashtra declares holiday on Monday
2022-02-07,RBI reschedules Monetary Policy Committee meeting as Maharashtra shut on Lata Mangeshkar death
2022-02-07,India central bank reschedules policy meeting after Lata Mangeshkar death
2022-02-07,SBI Ecowrap - 20 bps hike in reverse repo rate outside MPC
2022-02-07,investment strategy : Sell rallies in growth stocks in short term ; own oil stocks to hedge risk : Chris Wood
2022-02-07,"RBI may wait for a few more months to raise interest rates , says survey"
2022-02-07,RBI подождет еще несколько месяцев до очередного повышения ставки : опрос Reuters
2022-02-07,RBI postpones MPC meeting by a day due to Lata Mangeshkar death
2022-02-07,"RBI postpones key meet , halts operations today Lata Mangeshkar"
2022-02-08,Record Debt to Keep India Hikes in Slow Lane : Decision Guide
2022-02-08,"Sensex rises 187 pts , Nifty ends above 17 , 250 ; Bajaj twins gain"
2022-02-09,"Record debt , recovery support to keep rate hikes by RBI in slow lane"
2022-02-09,RBI : D - Day Guide : Record debt to keep RBI rate hikes in slow lane
2022-02-09,"Sensex jumps 657 pts , Nifty ends above 17 , 450 mark ; Maruti Suzuki jumps 4 %"
2022-02-10,"RBI के नीतिगत दरों को यथावत रखने से झूमा शेयर बाजार , सेंसेक्स 460 अंक से अधिक उछला"
2022-02-10,"Sanjeev Ahluwalia | Will digital rupee take India higher , faster ?"
2022-02-10,Centre GDP deflator forecast for FY23 is 3 - 3 . 5 %: FM Nirmala Sitharaman
2022-02-10,The RBI sanguine inflation bet - The Hindu BusinessLine
2022-02-10,"RBI maintains repo , reverse repo rate ; India Inc hails it a  welcome move"
2022-02-10,Monetary and fiscal policies cannot be a  question of either or : Das
2022-02-10,"In current times , monetary and fiscal policies cannot be a  question of either or : Shaktikanta Das"
2022-02-10,"shaktikanta das : In current times , monetary and fiscal policies cannot be a  question of either or : Shaktikanta Das"
2022-02-10,Rupee rate today : Rupee slides by 10 paise to 74 . 94 as RBI maintains accommodative stance
2022-02-10,"Nifty ends above 17 , 600 after RBI keeps rates unchanged"
2022-02-10,"Sensex , Nifty end higher on surprise RBI decision , accommodative stance"
2022-02-10,Rupee slips 10 paise to close at 74 . 94 against US dollar post RBI Policy
2022-02-10,Nifty today : SGX Nifty rises 35 points ; here what changed for market while you were sleeping
2022-02-10,Reserve Bank of India News | Latest News
2022-02-10,"RBI Monetary Policy | Nomura | earnings growth : Both RBI and govt prioritising growth ; expect 17 - 18 % earnings growth in FY23 : Prabhat Awasthi , Nomura"
2022-02-10,RBI 4 . 5 % retail inflation prediction will keep the low interest rate tap open
2022-02-10,Reserve Bank of India monetary policy : Repo and reverse repo rates unchanged
2022-02-10,"Stock Market LIVE : Sensex , Nifty likely to open flat today"
2022-02-10,Banks in India can offer foreign currency - settled rupee derivatives
2022-02-11,Rupee slumps 31 paise to 75 . 46 against US dollar in early trade
2022-02-11,Nifty Today | Market crash : SGX Nifty down 165 points ; here what changed while you were sleeping
2022-02-11,Rupee slips below 75 against dollar ; closes at six - week low
2022-02-11,Rupee slides by 10 paise to 74 . 94 as RBI maintains accommodative stance
2022-02-11,RBI dovish inflation call raises eyebrows as price pressures build
2022-02-11,stock market crash | Sunil Subramaniam : Sunil Subramaniam on how to make volatility your friend and not an enemy
2022-02-11,Why a spike in US inflation has spooked India equity markets today
2022-02-11,"Stock Market LIVE : Sensex , Nifty likely to open lower today"
2022-02-13,Markets to remain under pressure in a weak set up
2022-02-13,India rupee slips below 75 against dollar closes at six ...
2022-02-13,Today . Az - India rupee slips below 75 against dollar ; closes at six - week low
2022-02-13,Stock Markets to remain under pressure in a weak set up
2022-02-14,Rupee ends weaker ; Bonds rally - The Hindu BusinessLine
2022-02-14,LIC plays contrarian on Sensex firms
2022-02-14,RBI DG Rabi Sankar asks for complete ban on cryptocurrencies in India
2022-02-14,"Investment strategy | Market crash : Sensex crashes 2 , 450 points in two days ! Time to press  sell  button ?"
2022-02-14,Banning cryptocurrency perhaps most advisable choice open to India : RBI Dy . Guv
2022-02-14,Strange optimism
2022-02-15,"Sensex Rises 414 Points To 56 , 820 , IT Stocks Up , Share Market , Share Price | दोन दिवसांच्या घसरणीनंतर सेन्सेक्स 414 पॉइंट्सनी वाढून 56 , 820 वर , IT शेअर्समध्ये तेजी"
2022-02-15,"Reading the smoke signals right : Why capital inflows are a pain , not a growth fuel"
2022-02-15,Are markets in trouble ? Sensex dip and Rupee volatility explained in four charts
2022-02-15,"Market rallies on value buying ; Nifty regains 17 , 350 mark"
2022-02-15,India News | Rupee Slips 12 Paise to 75 . 72 Against US Dollar in Early Trade
2022-02-15,"Stock Market LIVE Updates : Sensex , Nifty off day highs ; Paytm , Zomato hit new lows"
2022-02-15,Indian rupee decline against UAE dirham continues - News
2022-02-15,КВИР - Рикша
2022-02-16,"RBI Crypto News : RBI should hold debates , discussions before any crypto decision : Experts"
2022-02-16,"How will the Russia - Ukraine crisis , US Fed affect rupee ?"
2022-02-16,"Interest rates are unlikely to go any lower , signals RBI"
2022-02-17,Nifty today : SGX Nifty up 45 points ; here what changed for market while you were sleeping
2022-02-17,Indian rupee decline against UAE dirham continues
2022-02-17,Emerging Asia Central Banks Are Running Out of Room to Wait
2022-02-18,"Sensex Fell 100 Points Below 57 Thousand , More Fall In Tech Stocks , Share Market , Share Price | सेन्सेक्स 100 अंकांनी कोसळून 57 हजारांच्या खाली , टेक शेअर्समध्ये घसरण"
2022-02-18,"As debt joins equities in FPI selloff , divergence between RBI and Fed grows starker"
2022-02-18,India to Indonesia : Emerging Asia central banks run out of room to wait
2022-02-18,"Digital Rupee : Digital Rupee News , Updates , Announcements"
2022-02-18,"Market slides for 3rd day , Nifty ends below 17 , 300"
2022-02-19,Public Expenditure Will Lead to Crowding in Private Investments
2022-02-21,NRIs : How can you best decide on the right property in India ?
2022-02-21,RBI to suck out $5 billion liquidity from the system ahead of LIC IPO
2022-02-21,"Sensex Fell By 200 Points , Reached 57578 , Most Of The Shares Were Down , Share Market , Share Price | सेन्सेक्स 170 पॉइंट्सने कोसळून 57670 वर पोहोचला , जास्तीत जास्त शेअर्स खाली"
2022-02-21,market analysis : Market Watch : Is weakness in newly listed stocks an opportunity to buy ?
2022-02-22,"Rupee Outlook Stable , But Russia - Ukraine Risks Can Derail The Currency"
2022-02-23,nifty50 : Market Watch : What sparked fag - end selling in Nifty today ?
2022-02-24,How the Ukraine crisis could hit the Indian economy
2022-02-24,"Markets tank as Russia attacks Ukraine ; Sensex , Nifty plunge over 4 . 7 %"
2022-02-25,"Sensex Up 850 Points , Investors Gain 5 Lakh Crore In 30 Seconds , Banking Stocks Rise , Share Market , Share Price | सेन्सेक्स 1 , 337 पॉइंट्सने वर , 5 मिनिटात गुंतवणूकदारांना 8 लाख कोटींचा फायदा ; बँकिंग स्टॉक्सही वाढले"
2022-02-25,"Ukraine crisis impact : With crude oil prices at $100 , where is rupee headed ?"
2022-02-25,How crude oil at $100 a barrel will affect India ?
2022-02-25,How crude oil at $100 will affect India
2022-02-25,Last weekly G - Sec auction of FY22 sails through - The Hindu BusinessLine
2022-02-25,Why are Indian markets rallying today when a war has broken out between Russia and Ukraine ?
2022-02-25,Russia - Ukraine War : What it portends for India
2022-02-25,XLRI VIL Advanced Product Management programme : The best way to propel your career in product management
2022-02-27,"FPIs pull out Rs 35 , 506 crores in February"
2022-02-28,"Sensex Fell 700 Points To 55125 , Investors Lost Rs 3 Lakh Crore , share Market , Share Price | सेन्सेक्स 800 अंकांनी कोसळला , गुंतवणूकदारांचे 3 . 5 लाख कोटींचे नुकसान"
2022-02-28,"Bombay stock exchange | शेयर बाजार में लिवाली का जोर , सेंसेक्‍स उछला , निफ्टी भी चढ़ा"
2022-02-28,An already slowed Indian economy faces fresh risks
2022-02-28,rupee fall today : Rupee sinks 47 paise vs dollar as crude prices spike sharply
2022-02-28,Economists say higher oil prices pose more risk to India growth momentum
2022-03-01,"brent crude : Crude oil surge will hit India macro outlook : Deutsche Bank , Chief Economist"
2022-03-01,"Measures afoot in financial sector to insulate markets , trade with Russia"
2022-03-09,"Sensex Rises 190 Points To 53169 , Tech And Pharma Stocks Rise | सेन्सेक्स 400 अंकांनी वाढून 53829 वर , टेक आणि फार्माच्या स्टॉक्समध्ये तेजी"
2022-03-11,"Sensex Rises 50 Points To 55530 , 16 Out Of All 30 Stocks Are Down , Maruti Falls 2 % | सेन्सेक्स 280 अंकांनी वाढून 55752 वर , फार्मा आणि बँकिंग सेक्टरचे शेअर्स तेजीत"
2022-03-15,market analysis : Market Watch : Market snaps 5 - day winning streak . How should investors time their entry now ?
2022-03-21,"Stock Market LIVE Updates : Sensex down 200 pts , Nifty50 below 17 , 250 amid choppy trade ; SBI , Kotak Bank drop 2 %"
2022-03-21,"Stock Market LIVE Updates : Sensex , Nifty weak amid choppy trade ; Hindalco , Maruti Suzuki and Coal India shares surge"
2022-03-22,Rail Vikas Nigam : सेन्सेक्स - निफ्टी वधारले ; मंगळवारच्या व्यवहारात हे ठरले बाजारातील तेजीचे सहप्रवासी शेअर - watch out for these buzzing stocks on wednesday
2022-03-22,"Sensex slides 265 points ; FMCG , banking stocks dip"
2022-03-22,Sensex Fall today : Share Market Updates : शेअर बाजारात घसरण कायम ; करोनाच्या नव्या व्हेरिएंटमुळे गुंतवणूकदार धास्तावले - share market news today 22nd march 2022 market fall continue due to covid new wave
2022-03-22,penny stocks : शेअर बाजार ; निर्देशांकांच्या पडझडीत हे पेनी स्टॉक अप्पर सर्किटमध्ये स्थिरावले - these penny stocks are locked in the upper circuit today
2022-03-22,"Sensex - Sensex , Nifty bounce back to close 1 pc higher on gains in RIL , Infosys , TCS"
2022-03-23,"Share Market LIVE : Sensex slips 250 points , Nifty below 17 , 250 ; Airtel , Kotak Bank , Maruti top losers"
2022-03-23,"Sensex Adds 2 , 000 Points In Two Days ; Nifty Closes Above 17 , 250"
2022-03-23,"Sensex declines 304 points , Nifty ends at 17 , 245"
2022-03-23,Paytm share price nse bse hits all - time low Parent firm clarifies
2022-03-23,Sensex ends 304 points lower in volatile session ; banking shares top losers
2022-03-23,Stock Market Update 23 March 2022
2022-03-23,"Sensex jumps over 400 points in early trade ; Handy above 17 , 400 level - Naveen Bharat : Breaking News , Get Today News , Latest News , India Top News"
2022-03-23,"Sensex declines by 304 points as HDFC twins , Infosys succumb to profit taking"
2022-03-23,Steel Authority of India Ltd continues to see good buying
2022-03-23,"Sensex , Nifty rise as banking stocks , global markets rally - The Hindu BusinessLine"
2022-03-23,"Sensex jumps over 400 points in early trade ; Nifty above 17 , 400 level"
2022-03-23,"Share Market LIVE : Sensex , Nifty likely to open higher today"
2022-03-23,Centre mothballs plan to let local firms list overseas
2022-03-23,sensex : Market Watch : Is there a lack of conviction at current valuations after last week rally ?
2022-03-23,"India News | Sensex Jumps over 400 Points in Early Trade ; Nifty Above 17 , 400 Level"
2022-03-23,Sensex jumps over 400 points in opening session
2022-03-23,"Sensex - Sensex jumps over 400 points in early trade ; Nifty above 17 , 400 level"
2022-03-23,"Stocks in news : Reliance Industries , Infosys , Adani Ports , Paytm and more"
2022-03-23,"Share Market Today , Sensex , Nifty , BSE , NSE , Share Prices , Stock Market News Live Updates | सेंसेक्स 331 पॉइंट की गिरावट के साथ 57 , 658 पर पहुंचा ; फार्मा शेयर में बढ़त जारी"
2022-03-23,માર્કેટ સ્કેન
2022-03-24,Different Types Of ETFs In India
2022-03-24,"Stocks in news : Zomato , Zee Entertainment , Ruchi Soya , HDFC and more"
2022-03-24,"Sensex falls 150 points , Nifty flat at 17 , 209 . 60"
2022-03-24,"Share Market LIVE : Sensex , Nifty likely to open lower today"
2022-03-24,"Sensex declines by 89 pts , Nifty falls nearly 23 pts in choppy trade"
2022-03-24,"शेयर बाजार पर दबाव , सेंसेक्स निफ्टी गिरावट में"
2022-03-24,"Bombay stock exchange | सेंसेक्स 89 अंक टूटा , निफ्टी भी हुआ कमजोर"
2022-03-24,low price stock : शेअरवर ठेवा लक्ष ; हे स्वस्त आणि मस्त स्टॉक शुक्रवारी तुमच्या पोर्टफोलिओमध्ये असू द्या - watch out for these low price stocks on friday
2022-03-24,Indian shares flat as investors weigh oil price spike ; Zee soars
2022-03-24,nifty50 : Market Watch : Is time for investors to buy the dip or wait out the volatility ?
2022-03-24,"Sensex , Nifty end lower for second straight session ; banking , consumer durables shares top losers"
2022-03-24,JSPL stock hits 52 - week high in volatile market ; here why
2022-03-24,"Sensex down 89 pts at closing , Nifty ends below 17 , 300 - The Hindu BusinessLine"
2022-03-24,Markets end on a weak note but pare losses towards fag - end ; banking stocks tumble
2022-03-24,"Sensex declines by 89 points , Nifty falls nearly 23 points in choppy trade"
2022-03-24,"Sensex , Nifty close lower in choppy trading session"
2022-03-24,"Share Market updates : Sensex falls 89 points , Nifty ends below 17 , 250 ; Kotak Bank , Titan , HDFC Bank top losers"
2022-03-24,"Sensex , Nifty fall as crude prices jump ; Zee Entertainment soars"
2022-03-24,"Share Market LIVE : Sensex falls 260 points , Nifty below 17 , 200 ; Kotak Bank , HDFC Bank , ICICI Bank top losers"
2022-03-24,"Share Market LIVE : Sensex falls 300 points , Nifty below 17 , 200 ; Kotak Bank , HDFC Bank , ICICI Bank top losers"
2022-03-24,"Share Market News Today | Sensex , Nifty , Share Prices LIVE | सेंसेक्स 289 पॉइंट की गिरावट के साथ 57 , 395 पर पहुंचा , निफ्टी 17 , 230 के नीचे ; मेटल और फार्मा के शेयर में बढ़त"
2022-03-24,"Business News : Weak start of Indian stock market , Nifty and Sensex open with red mark| business News in Hindi | Business News : भारतीय शेयर बाजार की कमजोर शुरूआत , लाल निशान के साथ खुले निफ्टी और सेंसेक्स"
2022-03-24,Penny Stocks Are Locked In The Upper Circuit Today | तेजीच्या शेअर बाजारात हे पेनी स्टॉक अप्पर सर्किटमध्ये पोहोचले
2022-03-25,"Nifty , Sensex Snaps Closes Lower Again – Friday Closing Report"
2022-03-25,"Stock Market Latest News Update Closed On Red Mark Sensex Slips 233 Points Nifty Fall - Stock Market Closed : उतार - चढ़ाव के बाद बाजार धड़ाम , सेंसेक्स 233 अंक फिसला , निफ्टी लाल निशान पर बंद"
2022-03-25,"Indices decline for third day ; FPIs sell shares worth Rs 1 , 507 crore"
2022-03-25,"तीसरे दिन गिरा बाजार , सेंसेक्स निफ्टी 0 . 40 प्रतिशत लुढ़के"
2022-03-25,"Sensex - Sensex , Nifty decline for third day as HDFC Bank , TCS slide"
2022-03-25,Should you invest in ICICI Pru Housing Opportunities NFO ? - The Hindu BusinessLine
2022-03-25,Shares end with limited losses ; realty shares outperform
2022-03-25,All You Need To Know About Stock Market Timings & Trading Sessions In India
2022-03-25,"शेयर बाजार में गिरावट जारी , सेंसेक्स - निफ्टी दोनों लुढ़के"
2022-03-25,Should you go for dividend yield funds when markets turn volatile ?
2022-03-25,"Bombay stock exchange | लगातार तीसरे दिन गिरावट , सेंसेक्स 233 अंक लुढ़का , निफ्टी भी टूटा"
2022-03-25,nifty50 : Market Watch : What are the key factors impacting investor sentiment ?
2022-03-25,"Sensex , Nifty fall for 3rd straight day on inflation , rate hike worries"
2022-03-25,"शेयर बाजार में लगातार तीसरे दिन गिरावट , सेंसेक्स 233 अंक टूटा"
2022-03-25,"Market ends in red ; Nifty ends below 17 , 200"
2022-03-25,"Stock Market India : Sensex Extends Fall , Slips 233 Points ; Nifty Barely Holds 17 , 150"
2022-03-25,"Sensex slips 233 points , Nifty closes below 17 , 200 ; Titan , TechM , Maruti top losers"
2022-03-25,Barometers trade with significant cuts ; IT stocks decline
2022-03-25,"Share Market LIVE : Sensex falls 330 points , Nifty below 17 , 150 ; Titan slips 3 %"
2022-03-25,Sensex - Sensex declines over 110 points in early trade
2022-03-25,"Share Market LIVE : Sensex falls 280 points , Nifty below 17 , 150 ; Titan slips 3 %"
2022-03-25,Broader market outperforms ; FMCG shares edge lower
2022-03-25,"एशियाई बाजारों के कमजोर रुख से सेंसेक्स 130 अंक से अधिक टूटा , निफ्टी भी 117 , 193 अंक पर"
2022-03-25,"Sensex declines over 110 points in early trade ; Nifty tests17 , 200"
2022-03-25,"Sensex closes 233 pts lower , Nifty ends below 17 , 300 - The Hindu BusinessLine"
2022-03-25,"Sensex declines over 110 points in early trade ; Nifty tests 17 , 200"
2022-03-25,"Stocks in news : Reliance Industries , Axis Bank , Larsen & Toubro , Tata Consumer and more"
2022-03-25,"Sensex , Nifty to open higher ; RIL , SBI , NTPC , Future Enterprises , IndusInd Bank shares eyed"
2022-03-25,"Markets end lower in volatile trade as sluggish global cues dampen sentiment ; banking , capital goods decline"
2022-03-25,"Sensex , Nifty decline for 3rd day as HDFC Bank , TCS slide"
2022-03-25,Indices trade in the red ; market breadth remains strong
2022-03-26,"शुरुआती कारोबार में सेंसेक्स 110 अंक से अधिक टूटा , निफ्टी 17 , 200 पर"
2022-03-26,"Nifty , Sensex May Try to Move Up – Weekly closing report"
2022-03-26,Nifty : Benchmark indices fall for 3rd consecutive day
2022-03-27,"शेयर बाजार पर वाहन बिक्री , पीएमआई और आईआईपी आंकड़ों का रहेगा असर"
2022-03-27,"वैश्विक रुख तय करेगा शेयर बाजारों की दिशा , कायम रहेगा उतार - चढ़ाव का दौर : विशेषज्ञ"
2022-03-28,"Sensex rebounds 231 points , Nifty recovers 69 points as RIL , ICICI Bank gain"
2022-03-28,"Market ends near intraday high ; Nifty above 17 , 200 mark"
2022-03-28,stock market | earnings : Will high input costs lower India Inc . earning growth to 10 - 12 %? Rahul Singh answers
2022-03-28,"Share Market Updates , Today investors have made profits in the market , know which stocks have the biggest jump : शेयर बाजार में आज सेंसेक्स और निफ्टी दोनों बढ़त के साथ हुए बंद"
2022-03-28,"Nifty Ends Above 17200 Sensex Gains 231 pts Led By Auto , Bank , oil and gas"
2022-03-28,"Sensex , Nifty snap three - day losing streak amid positive global cues"
